{
  "schemaVersion": "2.0.0",
  "generatedAt": "2026-05-08T18:23:57.489171Z",
  "sourceMode": "github-workflow",
  "diagnosticsRef": "insight_diagnostics.json",
  "sourceHealthRef": "insight_source_health.json",
  "cards": [
    {
      "eventId": "77c2ead108e94c9c99c37c743f31f39e",
      "bucket": "top_story_explainer",
      "headline": "Story 1 from national/general",
      "summary": "",
      "whyItMatters": "This is important context generated by the workflow.",
      "score": 0.53,
      "coverageLabel": "Good coverage",
      "sourceCount": 1,
      "independentSourceCount": 1,
      "hiddenDuplicateCount": 0,
      "topStoryAnchorId": "anchor-eb5d8000-ba6b-4306-b1d6-f210982bd7f5",
      "topStoryAnchorScore": 0.9,
      "topStoryAnchorBand": "strong",
      "snapshotPresence": {
        "now": true
      },
      "angles": [
        {
          "angle": "base_report",
          "source": "national/general",
          "admittedBecause": [
            "headline match"
          ]
        }
      ],
      "selectionReasons": [],
      "scoreBreakdown": {
        "topStoryAnchorScore": 0.9,
        "freshness": 0.8,
        "sourceAuthority": 0.7,
        "indepSource": 0.2,
        "persistence": 0,
        "rising": 0
      }
    }
  ]
}